category,headline
WELLNESS,Don’t Have Time For A Big Workout? Try ‘Exercise Snacking’
WELLNESS,New COVID Booster Shots May Be Coming This Fall. Here’s What To Know.
WELLNESS,10 ‘Harmless’ Nighttime Habits That Are Secretly Ruining Your Sleep
WELLNESS,The Difference Between Having Strong Feelings And Being Triggered
WELLNESS,10 Common Behaviors That Are Making You More Forgetful
WELLNESS,4 Sneaky Things That May Be Causing Your Nightmares
WELLNESS,"If You’re Going To Clean Out Your Ears Yourself, Here’s How To Do It Right"
WELLNESS,Turn Your Bathtub Into A Spa With These Customer-Approved Goods
WELLNESS,"This $10 Mosquito Repellent Gets 5 Stars From Me (And Over 2,000 Amazon Reviewers)"
WELLNESS,These Wearable Sleep Trackers Can Help You Unlock Better Shut-Eye
WELLNESS,"Without Roe V. Wade, Pregnant Women May Face Arrest For All Kinds Of Behaviors"
WELLNESS,There Are Millions Of People Who Can't Just 'Move On' From COVID
WELLNESS,7 Signs Your Mental Health Medication Isn't Working The Way It Should
WELLNESS,Conversations About Abortion Are Missing Voices: Trans And Nonbinary People
WELLNESS,How To Change Your Default Sleeping Position To A New One
WELLNESS,6 Ways You’re Contributing To Abortion Stigma Without Realizing It
WELLNESS,"The Most Common Questions About The Novavax COVID Vaccine, Answered"
WELLNESS,8 Sleep Tips For When Everything Is Bad And Your Brain Won't Shut Off
WELLNESS,7 Ways The 'Model Minority' Myth Hurts Asian American's Mental Health
WELLNESS,"If You're Doing This In Your Sleep, It's Time To See A Doctor"
PARENTING,My Adult Children Are Moving Out. Here’s What No One Told Me I’d Feel.
PARENTING,Don't Have Time For A Big Workout? Try 'Exercise Snacking'
PARENTING,Don’t Take Abortion Access For Granted Just Because You Live In A Blue State
PARENTING,Chris Pratt Shares How Backlash Over Remarks About His 'Healthy Daughter' Affected Him
PARENTING,Disney Adults Share Their 12 Best-Kept Park Secrets
PARENTING,The GOP’s Anti-LGBTQ Hysteria Is Spreading To Family Drag Shows
PARENTING,What You Need To Protect Your Family From Ticks This Summer
PARENTING,‘It Can Kill Us’: Protester On The Dire Cost Of Forced Birth For People With Disabilities
PARENTING,Ben Affleck's 10-Year-Old Son Drives Lamborghini Rental Into Parked Car
PARENTING,"My Husband And I Are Trying To Start A Family. Six Months Ago, I Had An Abortion."
PARENTING,My Daughter Almost Died At Summer Camp. Here's What I Wish I Told Her Before She Went.
PARENTING,20 Travel Items That You’ll Kick Yourself For Not Having Bought Before Your Last Trip
PARENTING,I'm A Trans Man. Here's What I Risked For The Chance To Get My Wife Pregnant With My DNA.
PARENTING,Just 30 Products That'll Make Your Outdoor Space The Place To Be This Summer
PARENTING,You Can’t Cheer Abortion Bans As ‘Justice For The Unborn’ While Promoting Fossil Fuels
PARENTING,Supreme Court Overturns Roe v. Wade
PARENTING,The Funniest Tweets From Parents This Week
PARENTING,A No-BS Guide To Finding The Best Ice Cream Maker For You
PARENTING,Reviewers Swear By These Products For Road Trips With Kids
PARENTING,10 'Harmless' Nighttime Habits That Are Secretly Ruining Your Sleep
TRAVEL,Disney Adults Share Their 12 Best-Kept Park Secrets
TRAVEL,"How To Take The Ultimate Vacation In Scottsdale, Even In The Summer"
TRAVEL,10 Mistakes Tourists Make While Visiting Seattle
TRAVEL,This Tiny Tool Will Prevent You From Being Charged For Overweight Luggage
TRAVEL,"Your Next Trip Abroad Should Be To Glasgow, Scotland. Here’s Why."
TRAVEL,Want To Buy Airport Lounge Access? Consider These 4 Things First.
TRAVEL,Looking For A Getaway? Here’s Why You Should Pick Savannah.
TRAVEL,24 Useful Travel Products That Won’t Take Up A Lot Of Space In Your Luggage
TRAVEL,The Ultimate Travel Accessories For Packing Like A Pro
TRAVEL,32 Things I Guarantee You Won’t Regret Having On Hand Next Time You Travel
TRAVEL,5 Hacks For Getting Into Airport Lounges For Cheap
TRAVEL,How To Take The Ultimate Vacation In Denver
TRAVEL,"What You Should Know About CLEAR, Global Entry And TSA PreCheck"
TRAVEL,The Last Howard Johnson's Restaurant In America Is Officially Closed
TRAVEL,Why This Small Town In Puerto Rico Should Be Your Next Vacation Spot
TRAVEL,"Yes, It's Possible To Take A Relaxing Vacation In Philly. Here's How."
TRAVEL,Why You Should Make This Florida Town Your Next Beach Vacation
TRAVEL,14 Mistakes Tourists Make While Visiting San Francisco
TRAVEL,Why This Island In Washington State Should Be Your Next Vacation Spot
TRAVEL,16 Mistakes Tourists Make While Visiting Austin
BUSINESS,"A Union At Medieval Times? Indeed, M’Lord."
BUSINESS,"U.S. Pools Close, Go Without Lifeguards Amid Labor Shortage"
BUSINESS,Maryland Apple Workers Face Hurdles After Vote To Unionize
BUSINESS,Apple Store Workers In Maryland Become First To Unionize
BUSINESS,"Elon Musk Offers Thoughts On Finances, Space Aliens In First Meeting With Twitter Staff"
BUSINESS,UPS Test Drives Tiny Battery-Powered Cycles For Deliveries In Congested Cities
BUSINESS,Data Likely Shows Teslas On Autopilot Crash More Than Rivals
BUSINESS,Elon Musk To Take Questions From Twitter Employees For First Time Since Deal
BUSINESS,Bitcoin Plunges As Major Crypto Lender Halts Operations
BUSINESS,Starbucks Union Says Howard Schultz Broke The Law During New York Times Interview
BUSINESS,Massachusetts Trader Joe’s Workers Seek Election To Form Company's First Union
BUSINESS,Starbucks Workers Unionize Store Where ‘Memphis Seven’ Were Fired
BUSINESS,Trader Joe’s Workers Say The Company Is Cracking Down On Their Union Effort
BUSINESS,Elon Musk Threatens To Walk Away From Twitter Deal
BUSINESS,Elon Musk Reportedly Tells Tesla Workers To Return To The Office Or Quit
BUSINESS,Elon Musk Says He Welcomes Recession So Money Stops 'Raining' Down On 'Fools'
BUSINESS,Lawsuit Accuses Elon Musk Of Trashing Twitter To Drive Down Price
BUSINESS,Trader Joe’s Cut Workers' Retirement Benefits During The Pandemic
BUSINESS,Walmart’s Juneteenth-Themed Ice Cream Ignites Outrage On Twitter
BUSINESS,Airbnb Pulls Out Of China
SPORTS,Formula One's Lewis Hamilton Says 'Archaic Mindsets' About Color Must Change
SPORTS,Texans 'Turned Blind Eye' To Deshaun Watson's Alleged Sexual Assaults: Lawsuit
SPORTS,How Saudi Arabia's New Professional Golf Series Is Shaking Up The Sport
SPORTS,"Marlin Briscoe, 1st Black Starting Quarterback In AFL, Dies"
SPORTS,Wimbledon Player Comes To Aid Of Fainting Ball Boy With Candy
SPORTS,WNBA Star Brittney Griner Ordered To Stand Trial Friday In Russia
SPORTS,Angels Pitcher Throws Edible Ammo At Mariners After Bench-Clearing Brawl
SPORTS,"Dog Interrupts International Soccer Match, Insists On Belly Rubs"
SPORTS,Chicago White Sox Help Turn 7-Year-Old Cancer Patient's Dream Into A Reality
SPORTS,Sha'Carri Richardson Flops In First Heat Of U.S. Championships
SPORTS,Spike Lee Consoles Stephen A. Smith In Viral NBA Draft Moment
SPORTS,NFL Hall Of Fame Running Back Hugh McElhenny Dies
SPORTS,"U.S. Swimmer Blacks Out Underwater At World Championships, Saved By Coach"
SPORTS,Former NFL Star Tony Siragusa Dies
SPORTS,NFL Seeks Arbitration For Flores' Racial Discrimination Suit
SPORTS,Baltimore Ravens Linebacker Jaylon Ferguson Dies At 26
SPORTS,Longtime MLB Pitcher Is Now A Super-Jacked Bodybuilder
SPORTS,Deshaun Watson Settles 20 Of 24 Sexual Misconduct Lawsuits
SPORTS,"Caleb Swanigan, Former NBA First-Round Pick, Dead At 25"
SPORTS,Sue Bird Plays Final Regular Season Game In New York And It Hits Close To Home
